<?xml version="1.0" encoding="UTF-8"?>
<!DOCTYPE Articles SYSTEM "Sans titre6.dtd">
<Articles>
    <titre>gg</titre>
    <contenu>
        <paragraphes>
            <mots>uytu</mots>
            <expressions>tytyu</expressions>
            <références>tyutyu</références>
        </paragraphes>
        <paragraphes>
            <mots>ytutyu</mots>
            <références>dgjhgd</références>
        </paragraphes>
        <paragraphes>
            <expressions>ghdjghdj</expressions>
            <références>ghdjy</références>
        </paragraphes>
    </contenu>
    <bibliographie>
        <siteweb>
            <nom>z'(truy</nom>
            <adressedesite>utyu</adressedesite>
        </siteweb>
        <ouvrage>
            <titreO>"''(yèrty</titreO>
            <auteurs>ayrtuy</auteurs>
            <datedeparution>tyeutyu</datedeparution>
            <éditeur>zryrtu</éditeur>
        </ouvrage>
    </bibliographie>
</Articles>
